,会社名,タイトル名,項目C
0,株式会社トップ | 《トップHDグループ》33歳*月給例:月給29.1万円＋インセン＋賞与,3人に1人は年収1000万円！【 提案営業 】*全国募集*経験者募集 正社員,
1,株式会社コシダカ | ★月収例29万4000円！★年休110日以上★東証一部上場グループ,カラオケ好き集合♪【カラオケ店舗社員】※職歴/学歴/年齢不問 正社員,
2,株式会社コシダカ | 【上場グループ企業】土日休みOK★月収29.4万円も目指せる！,社員評価90点越えの働きやすさ！【店舗マネージャー】★高卒以上 正社員,
3,"株式会社ビッグモーター | 【地元で稼げる】年収4,000万円の営業スタッフにインタビュー！",人生逆転できる！【営業職】経験/学歴/年齢/資格不問 ★転勤なし 正社員,
4,株式会社コシダカ | 【上場グループ企業】スピード昇格可★土日休みOK★年2回5連休,月30万を目指せる【カラオケ店員(店長候補)】*39歳以下/学歴不問 正社員,
5,株式会社コシダカ | 【上場グループ企業】月収例29.4万円★月8~10日休★年2回5連休！,まねきねこの【カラオケ店舗社員(店長候補)】*高卒以上/年齢不問 正社員,
6,株式会社日本セレモニー | コロナ禍でも黒字経営★典礼会館やFIVESTAR WEDDINGを運営！,【セレモニープランナー】働きやすい環境＆充実の研修をご用意！ 正社員,
7,株式会社ミュゼプラチナム | 人と話すことが好きな方大歓迎♪／PCスキル不要／WEB面接1回,【受付カウンセラー】未経験OK★高卒以上★年齢不問★賞与年4回 正社員,
8,株式会社NEXT STORIES | ★入社祝い金10万円有★年収1000万可※大阪府緊急雇用対策に賛同,【アフターフォロー営業】■月給30万～&完休2日制■テレアポなし 正社員,
9,株式会社ビッグモーター | 【業界No.1】◆スピード昇進可能 ◆役職手当最大20万円,★平均年収957万円★【車の営業(幹部候補)】※社会人経験者募集 正社員,
10,"株式会社ビッグモーター | 業界No.1企業◆平均年収957万円◆直近1年の最高年収4,600万円",月収15万円⇒月収150万円の実績あり【販売・買取営業】*高卒以上 正社員,
11,クルーガーグループ株式会社 | 全国で複数名採用◆面接1回◆自由な休みで週休3日も可能,安定環境で活躍する！【ルート営業】☆未経験歓迎 ☆年齢不問 正社員,
12,株式会社アイダ設計 | 1都2府21県へエリア拡大中／テレビ・ラジオCMでもお馴染みの企業,WEB集客多数★商談チャンスが多い【住宅営業】※男女活躍中 正社員,
13,株式会社ミュゼプラチナム | 美容脱毛専門サロン売上NO.1！全国に168店舗を展開する大手企業,未経験OK★全身美容脱毛0円【総合職(受付・エステ・企画・PR)】 正社員,
14,大東建託株式会社 | 【東証一部上場】◆全国募集◆残業代1分単位支給◆Web説明会実施,【営業】20万の入社支度金◆平均年収850万◆経験者募集 正社員,
15,朝日ソーラー株式会社 | 完全週休2日制を導入 | テレビCMも展開し知名度抜群！,"【 営業 】▼「年収1,000万円以上」も十分に目指せます！ 正社員",
16,アイアール株式会社 | ★完全週休2日制（土日祝） ★年間休日125日 ★超充実の福利厚生,休める！稼げる！楽しめる♪【施工管理アシスタント】★未経験OK 正社員,
17,HITOWAライフパートナー株式会社 | 全国募集★自宅開業OK★転勤なし◎未経験歓迎！学歴・スキル不問,全員面接★高収入も目指せる◎手に職が付く仕事【FCオーナー】 FCオーナー,
18,アップライブステージ株式会社 | テレワークの普及に伴い売上も2倍◎実績給で最高70万円支給有,【ライブ配信コーディネーター】★タレント発掘＆育成★高卒以上 正社員,
19,株式会社PGSホーム | ワーク・ライフ・バランス◎残業ほぼ無し！休日出勤は一切無し！,【営業総合職】※月給40万円～(2か月間)入社祝金最大138万円支給 正社員,
20,株式会社IDD | 未経験大歓迎/高収入/転勤なし/完全週休2日/ノルマ一切なし,★未経験大歓迎【通信コンサル営業】高収入・月収50万以上可能★ 正社員,
21,株式会社 ADAMASエンタープライズ | ★注目の事業で売上げ拡大中★転勤なし★年間休日110日以上,お客様との信頼を築く【サービススタッフ】特別な知識＆技術不要 正社員,
22,株式会社来来亭 | 好きな場所で年収1000万円超の店長へ｜20～30代活躍中,【店長候補】前職より給与UPした先輩多数／”無料”の寮完備 正社員,
23,株式会社インテリックス | 【東証一部上場】★収入2倍UPの先輩多数★年収2000万円以上も可,【法人営業】★BtoBだから完休2日&残業20h以内★フレックス勤務 正社員,
24,株式会社センス | ★未経験からでも年収1000万円超の先輩が活躍中★100％面接保証,【営業系総合職】週休3日／月末5連休などユニークな働き方も◎ 正社員,
25,株式会社谷川建設 | 年間20万本しか採れない木曽檜にこだわった完全自由設計住宅,完全反響型の【 住宅営業 】★高い社員定着率を誇ります！ 正社員,
26,株式会社サーバントップ | 完全週休2日制／残業なし／業界高水準のインセンティブ制度,成長×結果×対価＝年収1000万以上も可！【法人営業】※土日祝休 正社員,
27,株式会社東亜産業 | 賞与年2回（業績により）／20代～30代中心に活躍中！,NEWオープン！ディスカウントストアの【店長候補】 正社員,
28,ウィズライフ株式会社 | 安定成長企業・オンライン面接可・年収1500万円以上可能,【マンションメンテナンスの営業】平均月収55万円！転勤なし！ 正社員,
29,株式会社リモデルエステート | 転勤なし／全国26支店展開中の安定企業／WEB面接実施中,【賃貸住宅のリフォーム営業】平均月収60円！未経験歓迎！ 正社員,
30,有限会社Coo＆RIKU | 全国200店舗以上展開中のペット業界大手！,大手ペットショップの【店長候補】★中四国限定募集・月給30万～ 正社員,
31,株式会社アスカクリエート | 賞与年3回支給(昨年度実績8ヶ月分)／残業なし／年間休日125日,保育士さんと保育園をつなげる【人材コーディネーター】広島募集 正社員,
